{
  "schema_version": "1.0",
  "source_oin": "99999999900000000900",
  "version": "1.1.0",
  "issued_at": "2026-08-05T00:00:00Z",
  "expires_at": "2099-01-01T00:00:00Z",
  "capabilities": {
    "eudi": {
      "version": "1.0",
      "attestations": [
        {
          "type_id": "demo-inkomen",
          "type_version": "1.1",
          "offers": [
            {
              "id": "demo_inkomen_2025",
              "label": "Demo-inkomen 2025",
              "description": "Onbeveiligde HTTP-demonstratie van brononboarding",
              "parameters": {
                "jaar": 2025
              }
            }
          ],
          "graphql": {
            "endpoint": "http://unsecured-graphql-server:4000/graphql",
            "document": "query DemoInkomen($bsn: BSN!, $jaar: Int!) {\n  ingeschrevenPersoon(bsn: $bsn) {\n    heeftBelastingjaarAangifte(belastingjaren: [$jaar]) {\n      belastingjaar\n      status\n    }\n  }\n}",
            "subject_variable": "bsn",
            "parameters": {
              "jaar": {
                "type": "integer",
                "required": true
              }
            },
            "result_pointer": "/data/ingeschrevenPersoon/heeftBelastingjaarAangifte"
          },
          "mapping_profile": "gbo-simple-v1",
          "display": {
            "nl-NL": {
              "name": "Demo-inkomen",
              "description": "Alleen bedoeld om unsecured onboarding te testen",
              "summary": "Belastingjaar {{belastingjaar}}",
              "rendering": {
                "simple": {
                  "background_color": "#6b4f9b",
                  "text_color": "#ffffff"
                }
              }
            }
          },
          "claims": {
            "belastingjaar": {
              "source": {
                "pointer": "/belastingjaar",
                "datatype": "gYear"
              },
              "label": {
                "nl-NL": "Belastingjaar"
              }
            },
            "aangifte_status": {
              "source": {
                "pointer": "/status",
                "datatype": "string"
              },
              "label": {
                "nl-NL": "Status"
              }
            }
          }
        }
      ]
    }
  }
}
