{
  "schema_version": "1.0",
  "source_oin": "99999999900000000200",
  "version": "2.4.0",
  "issued_at": "2026-08-05T00:00:00Z",
  "expires_at": "2099-01-01T00:00:00Z",
  "capabilities": {
    "eudi": {
      "version": "1.0",
      "attestations": [
        {
          "type_id": "inkomensverklaring",
          "type_version": "2.4",
          "offers": [
            {
              "id": "inkomensverklaring_2024",
              "label": "Inkomensverklaring 2024",
              "description": "Inkomensverklaring over belastingjaar 2024",
              "parameters": {
                "jaar": 2024
              }
            },
            {
              "id": "inkomensverklaring_2025",
              "label": "Inkomensverklaring 2025",
              "description": "Inkomensverklaring over belastingjaar 2025",
              "parameters": {
                "jaar": 2025
              }
            }
          ],
          "graphql": {
            "service_reference": "bri",
            "endpoint": "/graphql",
            "document": "query Inkomensverklaring($bsn: BSN!, $jaar: Int!) {\n  ingeschrevenPersoon(bsn: $bsn) {\n    heeftBelastingjaarAangifte(belastingjaren: [$jaar]) {\n      belastingjaar\n      status\n      indieningsdatum\n      ... on AangifteIH {\n        verzamelinkomen { waarde valuta }\n        box1Inkomen { waarde valuta }\n        box2Inkomen { waarde valuta }\n        box3Inkomen { waarde valuta }\n      }\n    }\n  }\n}",
            "subject_variable": "bsn",
            "parameters": {
              "jaar": {
                "type": "integer",
                "required": true
              }
            },
            "result_pointer": "/data/ingeschrevenPersoon/heeftBelastingjaarAangifte"
          },
          "mapping_profile": "gbo-simple-v1",
          "display": {
            "nl-NL": {
              "name": "Inkomensverklaring",
              "description": "Verklaring van aangegeven inkomen",
              "summary": "€{{verzamelinkomen}} ({{belastingjaar}})",
              "rendering": {
                "simple": {
                  "background_color": "#0b5394",
                  "text_color": "#ffffff"
                }
              }
            }
          },
          "claims": {
            "belastingjaar": {
              "source": {
                "pointer": "/belastingjaar",
                "datatype": "gYear"
              },
              "label": {
                "nl-NL": "Belastingjaar"
              }
            },
            "indieningsdatum": {
              "source": {
                "pointer": "/indieningsdatum",
                "datatype": "date"
              },
              "label": {
                "nl-NL": "Indieningsdatum"
              }
            },
            "verzamelinkomen": {
              "source": {
                "pointer": "/verzamelinkomen/waarde",
                "datatype": "integer"
              },
              "label": {
                "nl-NL": "Verzamelinkomen"
              },
              "description": {
                "nl-NL": "Bedrag in euro's"
              }
            },
            "inkomen_box1": {
              "source": {
                "pointer": "/box1Inkomen/waarde",
                "datatype": "integer"
              },
              "label": {
                "nl-NL": "Inkomen box 1"
              },
              "description": {
                "nl-NL": "Bedrag in euro's"
              }
            },
            "inkomen_box2": {
              "source": {
                "pointer": "/box2Inkomen/waarde",
                "datatype": "integer"
              },
              "label": {
                "nl-NL": "Inkomen box 2"
              },
              "description": {
                "nl-NL": "Bedrag in euro's"
              }
            },
            "inkomen_box3": {
              "source": {
                "pointer": "/box3Inkomen/waarde",
                "datatype": "integer"
              },
              "label": {
                "nl-NL": "Inkomen box 3"
              },
              "description": {
                "nl-NL": "Bedrag in euro's"
              }
            },
            "aangifte_status": {
              "source": {
                "pointer": "/status",
                "datatype": "string"
              },
              "label": {
                "nl-NL": "Status"
              }
            }
          }
        }
      ]
    }
  }
}
