{
  "schema_version": "1.1",
  "source_oin": "99999999900000000200",
  "version": "2.6.0",
  "issued_at": "2026-08-12T00:00:00Z",
  "expires_at": "2099-01-01T00:00:00Z",
  "capabilities": {
    "eudi": {
      "version": "1.0",
      "attestations": [
        {
          "type_id": "akte-van-overlijden",
          "type_version": "2.4",
          "offers": [
            {
              "id": "akte_van_overlijden",
              "label": "Akte van overlijden",
              "description": "Overlijdensgegevens van de huwelijkspartner uit de BRP",
              "parameters": {}
            }
          ],
          "graphql": {
            "service_reference": "brp",
            "endpoint": "/graphql",
            "document": "query AkteVanOverlijden($bsn: BSN!) {\n  akteVanOverlijden(bsn: $bsn) {\n    overledene_geslachtsnaam overledene_voorvoegsel overledene_voornamen\n    overledene_geboortedatum overledene_geboorteplaats overledene_geboorteland\n    overledene_geslacht overledene_ouders datum_overlijden plaats_overlijden\n    land_overlijden soort_verbintenis echtgenoot_geslachtsnaam\n    echtgenoot_voorvoegsel echtgenoot_voornamen verklaring_tekst\n  }\n}",
            "subject_variable": "bsn",
            "parameters": {},
            "result_pointer": "/data/akteVanOverlijden"
          },
          "mapping_profile": "gbo-simple-v1",
          "display": {
            "nl-NL": {
              "name": "Akte van overlijden",
              "description": "Overlijdensgegevens van de huwelijkspartner",
              "summary": "{{overledene_voornamen}} {{overledene_geslachtsnaam}} ({{datum_overlijden}})",
              "rendering": {
                "simple": {
                  "background_color": "#3b3b46",
                  "text_color": "#ffffff"
                }
              }
            }
          },
          "claims": {
            "overledene_geslachtsnaam": {
              "source": {
                "pointer": "/overledene_geslachtsnaam",
                "datatype": "string"
              },
              "label": {
                "nl-NL": "Geslachtsnaam overledene"
              }
            },
            "overledene_voorvoegsel": {
              "source": {
                "pointer": "/overledene_voorvoegsel",
                "datatype": "string",
                "optional": true
              },
              "label": {
                "nl-NL": "Voorvoegsel overledene"
              }
            },
            "overledene_voornamen": {
              "source": {
                "pointer": "/overledene_voornamen",
                "datatype": "string"
              },
              "label": {
                "nl-NL": "Voornamen overledene"
              }
            },
            "overledene_geboortedatum": {
              "source": {
                "pointer": "/overledene_geboortedatum",
                "datatype": "date",
                "optional": true
              },
              "label": {
                "nl-NL": "Geboortedatum overledene"
              }
            },
            "overledene_geboorteplaats": {
              "source": {
                "pointer": "/overledene_geboorteplaats",
                "datatype": "string",
                "optional": true
              },
              "label": {
                "nl-NL": "Geboorteplaats overledene"
              }
            },
            "overledene_geboorteland": {
              "source": {
                "pointer": "/overledene_geboorteland",
                "datatype": "string",
                "optional": true
              },
              "label": {
                "nl-NL": "Geboorteland overledene"
              }
            },
            "overledene_geslacht": {
              "source": {
                "pointer": "/overledene_geslacht",
                "datatype": "string",
                "optional": true
              },
              "label": {
                "nl-NL": "Geslacht overledene"
              }
            },
            "overledene_ouders": {
              "source": {
                "pointer": "/overledene_ouders",
                "datatype": "string",
                "optional": true
              },
              "label": {
                "nl-NL": "Ouders overledene"
              }
            },
            "datum_overlijden": {
              "source": {
                "pointer": "/datum_overlijden",
                "datatype": "date"
              },
              "label": {
                "nl-NL": "Datum overlijden"
              }
            },
            "plaats_overlijden": {
              "source": {
                "pointer": "/plaats_overlijden",
                "datatype": "string",
                "optional": true
              },
              "label": {
                "nl-NL": "Plaats overlijden"
              }
            },
            "land_overlijden": {
              "source": {
                "pointer": "/land_overlijden",
                "datatype": "string",
                "optional": true
              },
              "label": {
                "nl-NL": "Land overlijden"
              }
            },
            "soort_verbintenis": {
              "source": {
                "pointer": "/soort_verbintenis",
                "datatype": "string"
              },
              "label": {
                "nl-NL": "Soort verbintenis"
              }
            },
            "echtgenoot_geslachtsnaam": {
              "source": {
                "pointer": "/echtgenoot_geslachtsnaam",
                "datatype": "string",
                "optional": true
              },
              "label": {
                "nl-NL": "Geslachtsnaam echtgenoot"
              }
            },
            "echtgenoot_voorvoegsel": {
              "source": {
                "pointer": "/echtgenoot_voorvoegsel",
                "datatype": "string",
                "optional": true
              },
              "label": {
                "nl-NL": "Voorvoegsel echtgenoot"
              }
            },
            "echtgenoot_voornamen": {
              "source": {
                "pointer": "/echtgenoot_voornamen",
                "datatype": "string",
                "optional": true
              },
              "label": {
                "nl-NL": "Voornamen echtgenoot"
              }
            },
            "verklaring_tekst": {
              "source": {
                "pointer": "/verklaring_tekst",
                "datatype": "string"
              },
              "label": {
                "nl-NL": "Verklaring"
              }
            }
          }
        }
      ]
    },
    "asi": {
      "version": "1.0",
      "authentic_source": {
        "legal_name": "Basisregistratie Personen (mock)",
        "country": "NL"
      },
      "graphql": {
        "service_reference": "brp",
        "endpoint": "/graphql",
        "document": "query Asi($bsn: BSN!) { ingeschrevenPersoon(bsn: $bsn) { ...Selected } }",
        "subject_variable": "bsn",
        "result_pointer": "/data/ingeschrevenPersoon"
      },
      "attributes": [
        {
          "identifier": "https://gbo.example/attributes/family_name/1",
          "fields": {
            "family_name": {
              "join": [
                "/voorvoegsel",
                "/geslachtsnaam"
              ],
              "separator": " "
            }
          }
        },
        {
          "identifier": "https://gbo.example/attributes/given_name/1",
          "fields": {
            "given_name": {
              "pointer": "/voornamen"
            }
          }
        },
        {
          "identifier": "https://gbo.example/attributes/birth_date/1",
          "fields": {
            "birth_date": {
              "pointer": "/geboortedatum"
            }
          }
        },
        {
          "identifier": "https://gbo.example/attributes/nationality/1",
          "fields": {
            "nationalities": {
              "each": "/heeftNationaliteit",
              "pointer": "/nationaliteit"
            }
          }
        },
        {
          "identifier": "https://gbo.example/attributes/address/1",
          "on": "Ingezetene",
          "fields": {
            "street": {
              "pointer": "/woontOp/straatnaam"
            },
            "house_number": {
              "join": [
                "/woontOp/huisnummer",
                "/woontOp/huisletter",
                "/woontOp/huisnummertoevoeging"
              ],
              "separator": " "
            },
            "postal_code": {
              "pointer": "/woontOp/postcode"
            },
            "city": {
              "pointer": "/woontOp/woonplaatsnaam"
            },
            "country": {
              "const": "NL"
            }
          }
        }
      ]
    }
  }
}
